<?xml version="1.0" encoding="UTF-8"?>
<xs:schema attributeFormDefault="unqualified"
           elementFormDefault="qualified"
           xmlns="http://stanovnik.net/ParallelTimetables professors.xsd"
           xmlns:xs="http://www.w3.org/2001/XMLSchema"
           targetNamespace="http://stanovnik.net/ParallelTimetables">
    <xs:element name="professors">
        <xs:complexType>
            <xs:sequence>
                <xs:element name="professor" maxOccurs="unbounded" minOccurs="1">
                    <xs:complexType>
                        <xs:sequence>
                            <xs:element name="name" type="xs:string"/>
                            <xs:element name="available_hours" type="xs:unsignedInt"/>
                        </xs:sequence>
                        <xs:attribute name="id" type="xs:integer" use="required"/>
                    </xs:complexType>
                </xs:element>
            </xs:sequence>
        </xs:complexType>
    </xs:element>
</xs:schema>
